{
  "$schema": "https://zeref-os.dev/registry.schema.json",
  "_comment_privacy_audit": "privacy-audit: allow-file — registry names skill/agent/command identifiers as canonical spec; no user data.",
  "version": "3.0.0-alpha.1",
  "generated": "2026-07-11",
  "skills": [
    {
      "skill": "wiki-maintenance",
      "triggers": [
        "update wiki",
        "update index",
        "consolidate memory",
        "clean up wiki",
        "after write",
        "post-write",
        "/wiki-maintenance",
        "/done"
      ],
      "deliverables": [
        "memory/index.md domain row updated",
        "duplicate decisions merged",
        "broken cross-references reported",
        "memory/hot.md refreshed (≤500 words)"
      ],
      "risk_level": "medium",
      "support_skills": [
        "memory-import-export"
      ],
      "reasoning_class": "fast",
      "status": "contract"
    },
    {
      "skill": "budget-governor",
      "triggers": [
        "/start",
        "session start",
        "budget warning",
        "token limit approaching",
        "tier change",
        "model changed",
        "config/BUDGET.md updated"
      ],
      "deliverables": [
        "active tier reported (Free / Standard / God Mode)",
        "token budget status",
        "verbosity rules applied"
      ],
      "risk_level": "low",
      "support_skills": [
        "wiki-maintenance"
      ],
      "reasoning_class": "fast",
      "status": "contract"
    },
    {
      "skill": "project-setup",
      "triggers": [
        "first /start (config/PROJECT.md missing)",
        "set up project",
        "initialize project",
        "missing config",
        "/start with no config",
        "configure this project"
      ],
      "deliverables": [
        "config/PROJECT.md written",
        "PRIVACY.md written",
        "REDACT.md written",
        "SHARING_POLICY.md written",
        "config/PERMISSIONS.md written",
        "config/PARENT_SYNC.md written (if parent enabled)",
        "config/BUDGET.md written"
      ],
      "risk_level": "medium",
      "support_skills": [],
      "reasoning_class": "balanced",
      "status": "runtime"
    },
    {
      "skill": "contradiction-resolution",
      "triggers": [
        "memory-keeper detects conflict during write",
        "review conflicts",
        "conflicting claims",
        "contradiction found",
        "/done (surfaces snoozed conflicts)"
      ],
      "deliverables": [
        "memory/CONFLICTS.md entry created",
        "conflict surfaced to user for arbitration",
        "winner written to memory/DECISIONS.md",
        "loser marked [SUPERSEDED]"
      ],
      "risk_level": "high",
      "support_skills": [
        "evidence-grader"
      ],
      "reasoning_class": "balanced",
      "status": "runtime"
    },
    {
      "skill": "evidence-grader",
      "triggers": [
        "grade this claim",
        "grade this",
        "how confident are we about",
        "what's the evidence for",
        "wiki-maintenance consolidation",
        "parent-sync filter step"
      ],
      "deliverables": [
        "evidence grade (high/medium/low/unverified)",
        "grade reasoning (3 fields: recency, provenance, corroboration)",
        "suggested action if grade below threshold"
      ],
      "risk_level": "low",
      "support_skills": [],
      "reasoning_class": "fast",
      "status": "runtime"
    },
    {
      "skill": "handoff-compiler",
      "triggers": [
        "handoff to",
        "switching to",
        "/stop with handoff requested",
        "handoff-orchestrator invokes",
        "prepare handoff",
        "model switch"
      ],
      "deliverables": [
        "STATE.json (machine-readable session state)",
        "SUMMARY.md (human-readable session summary)",
        "NEXT.md (next-session prompt)"
      ],
      "risk_level": "low",
      "support_skills": [
        "privacy-abstraction"
      ],
      "reasoning_class": "balanced",
      "status": "runtime"
    },
    {
      "skill": "memory-import-export",
      "triggers": [
        "import memory from",
        "export memory to",
        "/migrate",
        "backup memory",
        "restore memory",
        "migrate memory"
      ],
      "deliverables": [
        "portable archive with manifest",
        "memory/index.md reconstructed on import",
        "all entries pass privacy-guardian on export"
      ],
      "risk_level": "high",
      "support_skills": [
        "privacy-abstraction"
      ],
      "reasoning_class": "balanced",
      "status": "contract"
    },
    {
      "skill": "parent-sync",
      "triggers": [
        "approved /stop with parent sync enabled",
        "/sync-parent"
      ],
      "deliverables": [
        "memory/sync/outbound/ staged",
        "manifest.json created",
        "parent's memory/sync/parent/<child-id>/ updated",
        "conflicts surfaced at parent"
      ],
      "risk_level": "high",
      "support_skills": [
        "evidence-grader",
        "privacy-abstraction"
      ],
      "reasoning_class": "balanced",
      "status": "contract"
    },
    {
      "skill": "pattern-to-skill",
      "triggers": [
        "/review-skill picks up a candidate",
        "draft a skill from this pattern",
        "pattern-observer threshold hit"
      ],
      "deliverables": [
        "skills/drafts/<name>/SKILL.md created",
        "PROVENANCE.md created in draft dir",
        "skill NOT auto-activated — awaits /review-skill"
      ],
      "risk_level": "high",
      "support_skills": [
        "privacy-abstraction"
      ],
      "reasoning_class": "deep",
      "status": "contract"
    },
    {
      "skill": "skill-router",
      "triggers": [
        "every major task",
        "task domain detected",
        "after budget-governor gate passes",
        "what skills should run for this",
        "route this task"
      ],
      "deliverables": [
        "inline stack declaration: [skill-router] domain=<D> lead=<L> support=[..] qa=<Q> ext=<E>",
        "PATTERNS.jsonl event: skill-route",
        "smallest-useful-stack (max 5 skills)"
      ],
      "risk_level": "medium",
      "support_skills": [
        "fleet-activator",
        "budget-governor"
      ],
      "reasoning_class": "fast",
      "status": "contract"
    },
    {
      "skill": "fleet-activator",
      "triggers": [
        "invoked by skill-router when Extended-tool hint detected",
        "probe extended tools",
        "is ECC reachable",
        "check fleet reachability",
        "before any /ecc / /graphify / /browse invocation"
      ],
      "deliverables": [
        "inline reachability report: [fleet-activator] <tool>: reachable|UNREACHABLE",
        "PATTERNS.jsonl event: tool-probe (per probed tool)",
        "emulator substitution proposal if unreachable"
      ],
      "risk_level": "low",
      "support_skills": [],
      "reasoning_class": "fast",
      "status": "contract"
    },
    {
      "skill": "prompt-context-engine",
      "triggers": [
        "every major task (auto-gate)",
        "after skill-router stack declaration",
        "restructure this prompt",
        "classify this prompt",
        "UNSTRUCTURED prompt detected"
      ],
      "deliverables": [
        "inline Prompt Classification Report (3-5 lines)",
        "Structured Task Brief with <objective>/<deliverable>/<constraints>/<context>/<success_criteria> (when UNSTRUCTURED)",
        "Context Optimization Note (stripped context + cache hints)",
        "PATTERNS.jsonl event: prompt-gate"
      ],
      "risk_level": "medium",
      "support_skills": [
        "budget-governor",
        "skill-router"
      ],
      "reasoning_class": "balanced",
      "status": "runtime"
    },
    {
      "skill": "caveman-handoff",
      "triggers": [
        "/stop with handoff requested",
        "model switch detected",
        "compress this handoff",
        "caveman mode handoff",
        "handoff-compiler invokes for cross-model package"
      ],
      "deliverables": [
        "memory/sync/outbound/handoff-<iso>.md (caveman-grammar payload)",
        "memory/sync/outbound/handoff-<iso>.diff (R6 zero-context-loss diff)",
        "inline compression report: [caveman-handoff] orig=<n>tok compressed=<m>tok ratio=<r>%",
        "PATTERNS.jsonl event: handoff-compress"
      ],
      "risk_level": "medium",
      "support_skills": [
        "handoff-compiler",
        "prompt-context-engine",
        "privacy-abstraction"
      ],
      "reasoning_class": "fast",
      "status": "contract"
    },
    {
      "skill": "privacy-abstraction",
      "triggers": [
        "privacy-guardian invokes (mode = abstract)",
        "outbound transmission with mode = abstract",
        "before write when PRIVACY.md mode = abstract"
      ],
      "deliverables": [
        "payload rewritten with PII removed per REDACT.md classes",
        "provenance field preserved",
        "redaction log entry"
      ],
      "risk_level": "high",
      "support_skills": [],
      "reasoning_class": "fast",
      "status": "runtime"
    },
    {
      "skill": "skill-importer",
      "triggers": [
        "import external skill pack",
        "/import-skill",
        "sandbox-import from ~/.claude/skills",
        "sandbox-import from an operator-configured local path"
      ],
      "deliverables": [
        "skills/imported/<pack>/README.md (reference-only pointer)",
        "LICENSE-BOUNDARY.md capture",
        "foreign_code_containment benchmark green"
      ],
      "risk_level": "high",
      "support_skills": [
        "privacy-abstraction"
      ],
      "reasoning_class": "balanced",
      "status": "contract"
    }
  ],
  "agents": [
    {
      "agent": "memory-keeper",
      "path": "agents/memory-keeper.md",
      "runtime_backed": true,
      "role": "single-writer",
      "status": "contract"
    },
    {
      "agent": "privacy-guardian",
      "path": "agents/privacy-guardian.md",